name,address,website,phone_number,reviews_count,reviews_average,category,subcategory,city,state,area
Charyana Heights,"Charyana Heights, Mother Teresa Rd, Old City, Dhalgarwad, Bhadra, Ahmedabad, Gujarat 380001",facebook.com,073830 08521,,3.8,hotel,,ahmedabad,gujarat,"Charyana Heights, Mother Teresa Rd"
Hotel Silver Springs,"Shahalam Tolnaka, Opposite Swaminarayan College, Gita Mandir Rd, Jyoti Colony, Kankaria, Ahmedabad, Gujarat 380022",,098980 46301,,3.6,hotel,,ahmedabad,gujarat,"Shahalam Tolnaka, Opposite Swaminarayan College"
Wyndham Ahmedabad Shela,"Club O7 Rd, off Sardar Patel Ring Road, Shela, Gujarat 380057",wyndhamhotels.com,02717 245 703,,4.3,hotel,,ahmedabad,gujarat,"Club O7 Rd, off Sardar Patel Ring Road"
Arristo Resort & Club,"Sarkhej - Gandhinagar Hwy, opp. NIRMA UNIVERSITY, nr. Modi Sjikshan Sankool, Gota, Ahmedabad, Gujarat 382481",,,,3.4,hotel,,ahmedabad,gujarat,"Sarkhej - Gandhinagar Hwy, opp. NIRMA UNIVERSITY"
Hotel Sadbhav - shahibaug,"3rd Floor, Dhanlaxmi Chamber, Police commissioner's office, Dr Ambedkar Rd, Shahibag, Ahmedabad, Gujarat 380004",sites.google.com,,,3.5,hotel,,ahmedabad,gujarat,"3rd Floor, Dhanlaxmi Chamber"
Renaissance Ahmedabad Hotel,"Behind Ganesh Meridian Complex, Sola Road, Sarkhej - Gandhinagar Hwy, Ahmedabad, Gujarat 380060",marriott.com,079 4000 5000,,4.4,hotel,,ahmedabad,gujarat,"Behind Ganesh Meridian Complex, Sola Road"
Novotel Ahmedabad,"Iscon Cross Roads, Sarkhej - Gandhinagar Hwy, next to Wide Angle Cinema, Ahmedabad, Gujarat 380015",all.accor.com,079 4060 6060,,4.6,hotel,,ahmedabad,gujarat,"Iscon Cross Roads, Sarkhej - Gandhinagar Hwy"
Hotel Krishna,"Shiv Shakti, 4th Floor, Keshar Arcade, Nr:- Sentara Hospital BRTS Bus Stop Opp:, Chandkheda, Ahmedabad, Gujarat 382424",instagram.com,074900 33843,,4.6,hotel,,ahmedabad,gujarat,"Shiv Shakti, 4th Floor"
Hotel Kamran Palace,"Old City, Gheekanta, Lal Darwaja, Ahmedabad, Gujarat 380001",hotelkamranpalace.com,,,3.7,hotel,,ahmedabad,gujarat,"Old City, Gheekanta"
Hotel Radiant,"Paldi cross road, Paldi Rd, opposite Amts Bus Stop, opposite Adani CNG PUMP, Paldi, Ahmedabad, Gujarat 380007",hotelradiant.in,094271 07104,,3.7,hotel,,ahmedabad,gujarat,"Paldi cross road, Paldi Rd"
Hotel Westin Park,"4th Floor, Silver Star Heights, commercial complex, Chandlodiya Rd, Chandlodiya, Ahmedabad, Gujarat 382481",instagram.com,096013 54361,,3.3,hotel,,ahmedabad,gujarat,"4th Floor, Silver Star Heights"
Hotel Riverview,"Nehru Brg, near Sakar VII, Vishalpur, Ellisbridge, Ahmedabad, Gujarat 380009",riverviewhotels.in,079 4910 4910,,3.9,hotel,,ahmedabad,gujarat,"Nehru Brg, near Sakar VII"
Hotel DREAMLANDD,"chandkhed 3rd floor a, BRTS stop 382424, nr. Shiv Shakti Nagar, Durga Krupa Society, Nigam Nagar, Chandkheda, Ahmedabad, Gujarat 382424",oyorooms.com,097279 85415,,4.5,hotel,,ahmedabad,gujarat,"chandkhed 3rd floor a, BRTS stop 382424"
Hotel Green Tree,"3rd floor, Urja Complex, visat gandhinagar road, near d mart & vishwakarma temple, Rangjyot Society, Parvati Nagar, Motera, Ahmedabad, Gujarat 380005",hotelgreentree.in,090814 10520,,4.1,hotel,,ahmedabad,gujarat,"3rd floor, Urja Complex"
Hotel City Inn,"Seema Chambers, Relief Rd, opp. Electricity House, Old City, Gheekanta, Lal Darwaja, Ahmedabad, Gujarat 380001",,099251 23016,,4.1,hotel,,ahmedabad,gujarat,"Seema Chambers, Relief Rd"
Hotel Shivaay,"Balaji Agora Mall, 2nd floor swarnim the Business hub sms hospital, nr. passport seva kendra, opp. Sms Hospital, GIDC Bhat, Motera, Ahmedabad, Gujarat 380005",sites.google.com,098981 25229,,4.7,hotel,,ahmedabad,gujarat,"Balaji Agora Mall, 2nd floor swarnim the Business hub sms hospital"
Hotel Rajshree,"3rd Floor ,Kankaria Road, Golden Plaza, Opp Arya Samaj Mandir, Gujarat 380022",,099099 53867,,3.3,hotel,,ahmedabad,gujarat,"3rd Floor ,Kankaria Road"
"Hotel Pinnacle, Ahmedabad","Ashram Rd, Opp Town Hall, Madalpur Gam, Ellisbridge, Ahmedabad, Gujarat 380006",hotelpinnacle.com,079 2658 9907,,3.7,hotel,,ahmedabad,gujarat,"Ashram Rd, Opp Town Hall"
Hotel Asopalav,"47, Highway, Narolgam, Ahmedabad, Gujarat 380043",,099741 86440,,3.9,hotel,,ahmedabad,gujarat,"47, Highway"
Hotel Panshikura - Ahmedabad - Gujarat - India,"Near, behind Town, Under Bridge, Madalpur Gam, Ellisbridge, Ahmedabad, Gujarat 380006",,095589 03039,,3.8,hotel,,ahmedabad,gujarat,"Near, behind Town"
Hotel Sadbhav - shahibaug,"3rd Floor, Dhanlaxmi Chamber, Police commissioner's office, Dr Ambedkar Rd, Shahibag, Ahmedabad, Gujarat 380004",sites.google.com,,,3.5,hotel,,ahmedabad,gujarat,"3rd Floor, Dhanlaxmi Chamber"
Hotel Nilkanth,"2nd floor, Srushti Arcade Motera, nr. Tata Motors Cars Showroom, Motera, Ahmedabad, Gujarat 380005",hotelnilkanth.in,099133 07219,,4.0,hotel,,ahmedabad,gujarat,"2nd floor, Srushti Arcade Motera"
Hotel Asopalav,"47, Highway, Narolgam, Ahmedabad, Gujarat 380043",,099741 86440,,3.9,hotel,,ahmedabad,gujarat,"47, Highway"
The Metro Park Hotel,"2nd Floor, Pruthvi Complex, Ashram Rd, Usmanpura, Ahmedabad, Gujarat 380013",themetroparkhotel.com,081414 88824,,4.0,hotel,,ahmedabad,gujarat,"2nd Floor, Pruthvi Complex"
Hotel Paras Palace,"4th floor, himaliya square, Nava Naroda Rd, nr. Galaxy Cinema, Avadhpuri Society, Chandresh Society, Makarpura, Naroda, Ahmedabad, Gujarat 382330",,084888 14077,,3.5,hotel,,ahmedabad,gujarat,"4th floor, himaliya square"
mtrip hotel,"4th floor, Devnandan Mega Mall, opp. sanyash ashram, Ellisbridge, Ahmedabad, Gujarat 380009",mtriphotels.com,,,5.0,hotel,,ahmedabad,gujarat,"4th floor, Devnandan Mega Mall"
Hotel The Grand Crystal,"4th Floor Crystal Icon -2, near Capricorn Restuarnt, Nava Naroda, Ahmedabad, Gujarat 382330",,080004 22422,,4.6,hotel,,ahmedabad,gujarat,"4th Floor Crystal Icon -2, near Capricorn Restuarnt"
Tribecca Select,"Shree Balaji Agora Mall Rd, Sughad, Ahmedabad, Gujarat 382421",tribeccaagoramall.com,079 6157 0100,,4.2,hotel,,ahmedabad,gujarat,"Shree Balaji Agora Mall Rd, Sughad"
Hotel O Red Apple,"3rd Floor, Akansha Complex, 3, Ashram Rd, Rabarivas, Old Wadaj, Ahmedabad, Gujarat 380013",oyorooms.com,0124 620 1613,,3.5,hotel,,ahmedabad,gujarat,"3rd Floor, Akansha Complex"
Hotel Science City Inn,"Maurya Times Square, 2nd Floor, Science City Rd, Sola, Ahmedabad, Gujarat 380060",,075740 01793,,4.0,hotel,,ahmedabad,gujarat,"Maurya Times Square, 2nd Floor"
Renaissance Ahmedabad Hotel,"Behind Ganesh Meridian Complex, Sola Road, Sarkhej - Gandhinagar Hwy, Ahmedabad, Gujarat 380060",marriott.com,079 4000 5000,,4.4,hotel,,ahmedabad,gujarat,"Behind Ganesh Meridian Complex, Sola Road"
Hotel Kinara,"S.B.Tower, Near gheekanta Cross Road Behind Pir Mohammad Shah Road, Relief Rd, Ahmedabad, Gujarat 380001",,078020 52266,,3.9,hotel,,ahmedabad,gujarat,"S.B.Tower, Near gheekanta Cross Road Behind Pir Mohammad Shah Road"
Hotel Riverview,"Nehru Brg, near Sakar VII, Vishalpur, Ellisbridge, Ahmedabad, Gujarat 380009",riverviewhotels.in,079 4910 4910,,3.9,hotel,,ahmedabad,gujarat,"Nehru Brg, near Sakar VII"
Novotel Ahmedabad,"Iscon Cross Roads, Sarkhej - Gandhinagar Hwy, next to Wide Angle Cinema, Ahmedabad, Gujarat 380015",all.accor.com,079 4060 6060,,4.6,hotel,,ahmedabad,gujarat,"Iscon Cross Roads, Sarkhej - Gandhinagar Hwy"
HOTELTHEGRAND,"4th Floor, Sarovar Arcade, nr. Hathijan Circle, Phase IV, Vatva GIDC, Ahmedabad, Gujarat 382445",,077789 76599,,4.3,hotel,,ahmedabad,gujarat,"4th Floor, Sarovar Arcade"
"Hotel Damjis, Ahmedabad","Ashram Rd, Opposite AUDA-Ahmedabad Urban Development Authority, Sattar Taluka Society, Usmanpura, Ahmedabad, Gujarat 380014",,099099 46631,,3.2,hotel,,ahmedabad,gujarat,"Ashram Rd, Opposite AUDA-Ahmedabad Urban Development Authority"
Hotel Global-In,"4th Floor, Aditya Oopulence, Nr. Naroda railway Crossing N.H 8, Narol - Naroda Rd, Ahmedabad, Gujarat 382330",,,,3.8,hotel,,ahmedabad,gujarat,"4th Floor, Aditya Oopulence"
Hotel Fun Regency,"2nd Floor, S-Mall, Narendra Modi Stadium Road, near H.P. Petrol Pump, Motera, Ahmedabad, Gujarat 380005",funhotels.in,075758 44255,,4.8,hotel,,ahmedabad,gujarat,"2nd Floor, S-Mall"
Hotel Karnavati,"4th floor, Urja Avenue, Visat - Tapovan Main Road, nr. Tanishq Jewellers, Rangjyot Society, Parvati Nagar, Motera, Ahmedabad, Gujarat 380005",bookmystay.io,070468 66136,,4.8,hotel,,ahmedabad,gujarat,"4th floor, Urja Avenue"
Hotel One up,"petrol pump, 4669, opp. pathahr kuva, Old City, Gheekanta, Bhadra, Ahmedabad, Gujarat 380001",hoteloneup.com,094270 43651,,4.4,hotel,,ahmedabad,gujarat,"petrol pump, 4669"
Novotel Ahmedabad,"Iscon Cross Roads, Sarkhej - Gandhinagar Hwy, next to Wide Angle Cinema, Ahmedabad, Gujarat 380015",all.accor.com,079 4060 6060,,4.6,hotel,,ahmedabad,gujarat,"Iscon Cross Roads, Sarkhej - Gandhinagar Hwy"
HOTELTHEGRAND,"4th Floor, Sarovar Arcade, nr. Hathijan Circle, Phase IV, Vatva GIDC, Ahmedabad, Gujarat 382445",,077789 76599,,4.3,hotel,,ahmedabad,gujarat,"4th Floor, Sarovar Arcade"
"Hotel Damjis, Ahmedabad","Ashram Rd, Opposite AUDA-Ahmedabad Urban Development Authority, Sattar Taluka Society, Usmanpura, Ahmedabad, Gujarat 380014",,099099 46631,,3.2,hotel,,ahmedabad,gujarat,"Ashram Rd, Opposite AUDA-Ahmedabad Urban Development Authority"
Hotel Global-In,"4th Floor, Aditya Oopulence, Nr. Naroda railway Crossing N.H 8, Narol - Naroda Rd, Ahmedabad, Gujarat 382330",,,,3.8,hotel,,ahmedabad,gujarat,"4th Floor, Aditya Oopulence"
Hotel Fun Regency,"2nd Floor, S-Mall, Narendra Modi Stadium Road, near H.P. Petrol Pump, Motera, Ahmedabad, Gujarat 380005",funhotels.in,075758 44255,,4.8,hotel,,ahmedabad,gujarat,"2nd Floor, S-Mall"
"HOTEL REGENTA INN RANIP - AHMEDABAD, BY ROYAL ORCHID HOTELS .","3H9G+CC5 THE FAMILY MALL, ARVED TRANSCUBE PLAZA, 132 Feet Ring Rd, opp. Adi-Jati Girls Hostel, Bandhu Nagar, Vijay Nagar, Ranip, Ahmedabad, Gujarat 382480",royalorchidhotels.com,075748 38607,,4.1,hotel,,ahmedabad,gujarat,"3H9G+CC5 THE FAMILY MALL, ARVED TRANSCUBE PLAZA"
Hotel Karnavati,"4th floor, Urja Avenue, Visat - Tapovan Main Road, nr. Tanishq Jewellers, Rangjyot Society, Parvati Nagar, Motera, Ahmedabad, Gujarat 380005",bookmystay.io,070468 66136,,4.8,hotel,,ahmedabad,gujarat,"4th floor, Urja Avenue"
Hotel One up,"petrol pump, 4669, opp. pathahr kuva, Old City, Gheekanta, Bhadra, Ahmedabad, Gujarat 380001",hoteloneup.com,094270 43651,,4.4,hotel,,ahmedabad,gujarat,"petrol pump, 4669"
Hotel Shaligram Inn,"C, Block-4, bus stand, 4th and 5th floor, uptown North Star, opposite Geeta Mandir, Ahmedabad, Gujarat 380022",hotelshaligram.in,092270 27773,,4.4,hotel,,ahmedabad,gujarat,"C, Block-4"
Hotel Exostic,"Anar complex, Darpan Cir, beside avron hospital, near naranpura, Rangupavan Society, Sardar Patel Colony, Sundar Nagar, Naranpura, Ahmedabad, Gujarat 380013",hotelexoticahm.in,098981 56030,,4.6,hotel,,ahmedabad,gujarat,"Anar complex, Darpan Cir"
The Ummed Ahmedabad,"The Ummed, Airport Cir, Sardarnagar, Hansol, Ahmedabad, Gujarat 382475",ummedhotels.com,079 6666 1234,,4.2,hotel,,ahmedabad,gujarat,"The Ummed, Airport Cir"
HOTEL PALAV PALACE,"oppo Bharat petrol pump, Bhagyoday Shopping Center, n.h, Naroda, bethak, Ahmedabad, Gujarat 382330",,097256 62227,,4.3,hotel,,ahmedabad,gujarat,"oppo Bharat petrol pump, Bhagyoday Shopping Center"
Hotel Airport View,"Sindhi Colony Takwani, 10/A, Gali Nr approach Road, nr. R J Hotel, Sardarnagar, Hansol, Ahmedabad, Gujarat 382475",hotelairportview.in.net,070424 24242,,3.8,hotel,,ahmedabad,gujarat,"Sindhi Colony Takwani, 10/A"
Hotel R K villa,"A-22, 1st floor, Shakti Dhara Complex, Lal Bahadur Shastri Rd, opp. Kakadiya hospital, above Gwalia sweets, Vadilal Park, Shaktidhara Society, Bapunagar, Ahmedabad, Gujarat 380024",linktr.ee,087358 44657,,4.3,hotel,,ahmedabad,gujarat,"A-22, 1st floor"
Hotel Riverfront,"Bhagatachyarya road, opposite Museum, Nr. NID, Paldi, Ahmedabad, Gujarat 380007",hotelriverfront.co.in,094280 01360,,3.6,hotel,,ahmedabad,gujarat,"Bhagatachyarya road, opposite Museum"
Hotel Arotel,"1st Floor, Krish ArcadeComplex, above Punjab Sindh Bank, nr. Adani Circle. SP, Ramol, Ahmedabad, Gujarat 382449",linktr.ee,095589 65448,,4.4,hotel,,ahmedabad,gujarat,"1st Floor, Krish ArcadeComplex"
Hotel Relax Inn,"2nd Floor, Yogi Complex, Drive In Rd, b/h Relience Mall, Sunrise Park, Gurukul, Ahmedabad, Gujarat 380054",hotelrelaxahm.in,,,4.7,hotel,,ahmedabad,gujarat,"2nd Floor, Yogi Complex"
Hotel Gitanjali,"Bank of india, police station, Relief Rd, near Kalupur, Old City, Zaveriwad, Kalupur, Ahmedabad, Gujarat 380001",,083066 96939,,3.2,hotel,,ahmedabad,gujarat,"Bank of india, police station"
HOTEL ASIANA MOTERA AHMEDABAD,"2nd Floor Vitthal The Mall Near Vishwakrama Engineering College Visat-Gandhinagar Highway Near ONGC.Cricle Motera Chandkheda Ahmedabad CONTACT NUMBER.7041761100, Ahmedabad, Gujarat 380005",bookmystay.io,070417 61100,,4.5,hotel,,ahmedabad,gujarat,"2nd Floor Vitthal The Mall Near Vishwakrama Engineering College Visat-Gandhinagar Highway Near ONGC.Cricle Motera Chandkheda Ahmedabad CONTACT NUMBER.7041761100, Ahmedabad"
"Hotel Nest Pride - Best Hotel Room In Ahmedabad, Family Hotel In Ahmedabad, Couple Friendly Hotel In Ahmedabad","2nd floor, Aastha Complex, 1, Subhash Bridge Cricle, opp. Nandanvan Complex, Keshav Nagar, Ahmedabad, Gujarat 380021",,096017 70160,,4.7,hotel,,ahmedabad,gujarat,"2nd floor, Aastha Complex"
"Rivera Sarovar Portico, Ahmedabad","Bhavan’s College Road Sabarmati Riverfront, Mahaveer Marg, Khanpur, Ahmedabad, Gujarat 380001",,079 2560 1111,,3.3,hotel,,ahmedabad,gujarat,"Bhavan’s College Road Sabarmati Riverfront, Mahaveer Marg"
in&out AC Dormitory Ahmedabad,"Lift hai, Arved transcube plaza, 2nd Floor from GSRTC Bus Station (Bus platform no. 1 ke pass, 132 Feet Ring Rd, Ahmedabad, Gujarat 382480",,079 4918 4358,,4.1,hotel,,ahmedabad,gujarat,"Lift hai, Arved transcube plaza"
Hotel Rajshree,"3rd Floor ,Kankaria Road, Golden Plaza, Opp Arya Samaj Mandir, Gujarat 380022",,099099 53867,,3.3,hotel,,ahmedabad,gujarat,"3rd Floor ,Kankaria Road"
Hotel Shree Regency,"Naroda icon, 7th Floor , Nr Ranasan Toll Tax S.P Ring Road, Service Rd, Muthia, GIDC Naroda, Ahmedabad, Gujarat 382330",,084859 60805,,4.9,hotel,,ahmedabad,gujarat,"Naroda icon, 7th Floor"
Hotel O Shubham Inn,"2nd, Silver Square, Complex, Baghban cross road, Thaltej, Ahmedabad, Gujarat 380059",oyorooms.com,0124 620 1613,,4.2,hotel,,ahmedabad,gujarat,"2nd, Silver Square"
Hotel Seven Inn,"1st Floor, Kasturbhai Chambers, RTO Cir, Sastri Nagar, Hridaya Kunj, Keshav Nagar, Ahmedabad, Gujarat 380027",,095373 36969,,3.8,hotel,,ahmedabad,gujarat,"1st Floor, Kasturbhai Chambers"
Hotel Panshikura - Ahmedabad - Gujarat - India,"Near, behind Town, Under Bridge, Madalpur Gam, Ellisbridge, Ahmedabad, Gujarat 380006",,095589 03039,,3.8,hotel,,ahmedabad,gujarat,"Near, behind Town"
Varakhwala Heritage Hotel,"Rehnuma Society, Royal Nawab Society, Juhapura, Ahmedabad, Gujarat 380055",varakhwala.com,,,3.8,hotel,,ahmedabad,gujarat,"Rehnuma Society, Royal Nawab Society"
Hotel O N R Formerly Nayan Residency,"5th Floor, Medicon Arcade, near Honest, opp. Indian Petrol Pump Galaxy Cinema, Anjaney Krupa Society, Naroda, Ahmedabad, Gujarat 382330",oyorooms.com,0124 620 1613,,5.0,hotel,,ahmedabad,gujarat,"5th Floor, Medicon Arcade"
BloomSuites | Ahmedabad,"34, Surdhara Rd, opp. Kolkata Kulture, Nilmani Society, Thaltej, Ahmedabad, Gujarat 380054",staybloom.com,079 4702 0222,,4.4,hotel,,ahmedabad,gujarat,"34, Surdhara Rd"
Hotel Raj Palace,"1st Floor, Heritage Plaza, SGVP SHREE SWAMINARAYAN GURUKUL MEMNAGAR, nr. Swaminarayan Temple, Sushil Nagar Society, Memnagar, Ahmedabad, Gujarat 380052",linktr.ee,085116 18574,,3.5,hotel,,ahmedabad,gujarat,"1st Floor, Heritage Plaza"
Hotel Silver Inn,"2nd Floor, Tapovan Circle, Atishay Prism, Visat, Gandhinagar Highway, Nigam Nagar, Chandkheda, Ahmedabad, Gujarat 380005",hotelsilverinn.in,096620 69835,,4.2,hotel,,ahmedabad,gujarat,"2nd Floor, Tapovan Circle"
"Hotel Pinnacle, Ahmedabad","Ashram Rd, Opp Town Hall, Madalpur Gam, Ellisbridge, Ahmedabad, Gujarat 380006",hotelpinnacle.com,079 2658 9907,,3.7,hotel,,ahmedabad,gujarat,"Ashram Rd, Opp Town Hall"
Hotel NS Residency,"Gopal Palace, B-215, Nehru Nagar Cir, nr. Shiromani Complex, Acharya Narendradev Nagar, Ambawadi, Ahmedabad, Gujarat 380015",hotelnsresidency.in,082382 31339,,4.5,hotel,,ahmedabad,gujarat,"Gopal Palace, B-215"
Hotel Anand Palace,"4 Flor Paradise Plaza Circle nr. Vinzol, Vatva, Ahmedabad, Gujarat 382445",booking.com,,,4.0,hotel,,ahmedabad,gujarat,"4 Flor Paradise Plaza Circle nr. Vinzol, Vatva"
The Cama - A Sabarmati Riverfront Hotel,"2HJG+FPF, Mahaveer Marg, Old City, Khanpur, Ahmedabad, Gujarat 380001",camahotel.com,079 2560 1234,,4.1,hotel,,ahmedabad,gujarat,"2HJG+FPF, Mahaveer Marg"
Hotel Galaxy inn,"42/43 3floor, Vadilal Park, Shaktidhara Society, Bapunagar, Ahmedabad, Gujarat 380024",hotelgalaxy-inn.com,095584 24322,,4.8,hotel,,ahmedabad,gujarat,"42/43 3floor, Vadilal Park"
"Hotel Avadh Palace, Subhash Bridge, RTO Circle, Ahmedabad","B-201, 2nd Floor, Tirth Jyoti Plaza Opp Jail Bhajiya House, Subhash Bridge, RTO Cir, near Gandhi Ashram, Ranip, Ahmedabad, Gujarat 380027",sites.google.com,099980 29439,,4.1,hotel,,ahmedabad,gujarat,"B-201, 2nd Floor"
Hotel Royal Square by Sky Stays,"4HGM+2G2, Tragad Rd, near Jundal, near Bagga Hyundai Showroom, Chandkheda, Zundal, Ahmedabad, Gujarat 382424",secure-booking-engine.com,,,4.3,hotel,,ahmedabad,gujarat,"4HGM+2G2, Tragad Rd"
Aarya Grand Hotels & Resorts,"Kargil Petrol Pump Lane, Vrundavan Party Plot Rd, near Gujarat High Court, Sola, Ahmedabad, Gujarat 380060",aaryagrand.com,096240 00666,,4.2,hotel,,ahmedabad,gujarat,"Kargil Petrol Pump Lane, Vrundavan Party Plot Rd"
Hotel G Express,"Nr siddhivinayank Circle, 5, beside Kankaria Road, Kankaria, Maninagar, Ahmedabad, Gujarat 380008",gexpresshotel.com,090999 94990,,4.1,hotel,,ahmedabad,gujarat,"Nr siddhivinayank Circle, 5"
HOTEL REVANTA INN,"5th Floor, Gagandeep Tower, nr. Udupi Restaurant, Kocharab, Paldi, Ahmedabad, Gujarat 380006",,098982 43496,,4.9,hotel,,ahmedabad,gujarat,"5th Floor, Gagandeep Tower"
Hotel O Red Apple,"3rd Floor, Akansha Complex, 3, Ashram Rd, Rabarivas, Old Wadaj, Ahmedabad, Gujarat 380013",oyorooms.com,0124 620 1613,,3.5,hotel,,ahmedabad,gujarat,"3rd Floor, Akansha Complex"
Hotel Ajanta,"2HHM+W4W, Mirzapur Rd, near Jansatta Press, Old City, Gheekanta, Bhadra, Ahmedabad, Gujarat 380001",,097248 97564,,3.5,hotel,,ahmedabad,gujarat,"2HHM+W4W, Mirzapur Rd"
Hotel Relax Inn,"2nd Floor, Yogi Complex, Drive In Rd, b/h Relience Mall, Sunrise Park, Gurukul, Ahmedabad, Gujarat 380054",hotelrelaxahm.in,,,4.7,hotel,,ahmedabad,gujarat,"2nd Floor, Yogi Complex"
Hotel Sagar Inn,"Sadakat Building Kadia Kui, Relief RoadGujarat, India, Tilak Marg, Near Zakaria Masjid, Kalupur, Ahmedabad, Gujarat 380001",hotelsagarinn.com,079 2216 4711,,3.8,hotel,,ahmedabad,gujarat,"Sadakat Building Kadia Kui, Relief RoadGujarat"
Hotel O Veejay,"Veeray 3rd floor, Rudra Plus Complex, Hotel D, Chimanlal Girdharlal Rd, opp. Girish cold drinks, Navrangpura, Ahmedabad, Gujarat 380006",oyorooms.com,0124 620 1613,,3.4,hotel,,ahmedabad,gujarat,"Veeray 3rd floor, Rudra Plus Complex"
Hotel Green Tree,"3rd floor, Urja Complex, visat gandhinagar road, near d mart & vishwakarma temple, Rangjyot Society, Parvati Nagar, Motera, Ahmedabad, Gujarat 380005",hotelgreentree.in,090814 10520,,4.1,hotel,,ahmedabad,gujarat,"3rd floor, Urja Complex"
OYO Hotel Home Of Maa,"police station brts, bus stop, saubhagya nagar, near sabarmati, behind Baronet Complex, Sabarmati, Ahmedabad, Gujarat 380005",oyorooms.com,0124 620 1613,,2.1,hotel,,ahmedabad,gujarat,"police station brts, bus stop"
Hotel AARAM Rooms & Dormitory,"Kadiakui, Relief Rd, near ahmedabad railway station, Char Rasta, Tankshal, Khadia, Ahmedabad, Gujarat 380001",,097128 10429,,4.6,hotel,,ahmedabad,gujarat,"Kadiakui, Relief Rd"
Hotel Nilkanth,"2nd floor, Srushti Arcade Motera, nr. Tata Motors Cars Showroom, Motera, Ahmedabad, Gujarat 380005",hotelnilkanth.in,099133 07219,,4.0,hotel,,ahmedabad,gujarat,"2nd floor, Srushti Arcade Motera"
Hotel Global-In,"4th Floor, Aditya Oopulence, Nr. Naroda railway Crossing N.H 8, Narol - Naroda Rd, Ahmedabad, Gujarat 382330",,,,3.8,hotel,,ahmedabad,gujarat,"4th Floor, Aditya Oopulence"
Hotel Raj Palace,"1st Floor, Heritage Plaza, SGVP SHREE SWAMINARAYAN GURUKUL MEMNAGAR, nr. Swaminarayan Temple, Sushil Nagar Society, Memnagar, Ahmedabad, Gujarat 380052",linktr.ee,085116 18574,,3.5,hotel,,ahmedabad,gujarat,"1st Floor, Heritage Plaza"
Artilla Inn (Hotel - Conference -Banquet),"At, Swami Vivekananda Pool, opposite Town Hall, Ellisbridge, Ahmedabad, Gujarat 380006",artillainn.com,090814 40429,,4.4,hotel,,ahmedabad,gujarat,"At, Swami Vivekananda Pool"
hotel hill top inn vatva,"Narol - Vatva Rd, Vatva, Ahmedabad, Gujarat 382440",,098253 56568,,5.0,hotel,,ahmedabad,gujarat,"Narol - Vatva Rd, Vatva"
Hotel Sunsarovar,"First Floor, Nirav Shopping Center, nr. Old Railway crossing, Maninagar East, Khokhra, Ahmedabad, Gujarat 380008",,096620 25770,,3.9,hotel,,ahmedabad,gujarat,"First Floor, Nirav Shopping Center"
The Metropole Hotel(unit of Majestic Projects Pvt. Ltd.),"Subhash Bridge, near RTO Circle, Keshav Nagar, Ahmedabad, Gujarat 380027",,079 4105 0200,,4.1,hotel,,ahmedabad,gujarat,"Subhash Bridge, near RTO Circle"
Hotel O Shubham Inn,"2nd, Silver Square, Complex, Baghban cross road, Thaltej, Ahmedabad, Gujarat 380059",oyorooms.com,0124 620 1613,,4.2,hotel,,ahmedabad,gujarat,"2nd, Silver Square"
Tribecca Select,"Shree Balaji Agora Mall Rd, Sughad, Ahmedabad, Gujarat 382421",tribeccaagoramall.com,079 6157 0100,,4.2,hotel,,ahmedabad,gujarat,"Shree Balaji Agora Mall Rd, Sughad"
Hotel Kalash Residency Ahmedabad,"2nd Floor, Vishwa Complex, Hotel Kalash Residency, opp. Siddhachal Road, Navrangpura, Ahmedabad, Gujarat 380009",,076003 13632,,3.5,hotel,,ahmedabad,gujarat,"2nd Floor, Vishwa Complex"
Hotel Stay Inn,"1st Floor Third eye one Complex, Opp: Honest Restaurant panchvati cross road, Chimanlal Girdharlal Rd, Ahmedabad, Gujarat 380009",booking.com,091574 15708,,3.8,hotel,,ahmedabad,gujarat,"1st Floor Third eye one Complex, Opp: Honest Restaurant panchvati cross road"
Hotel Galaxy inn,"42/43 3floor, Vadilal Park, Shaktidhara Society, Bapunagar, Ahmedabad, Gujarat 380024",hotelgalaxy-inn.com,095584 24322,,4.8,hotel,,ahmedabad,gujarat,"42/43 3floor, Vadilal Park"
Hotel Twilight,"Kalupur Railway Station Rd, near Ashirwad Market, opp. Railway Station, Kapasia Bazar, Sakar Bazzar, Kalupur, Ahmedabad, Gujarat 380002",,079 2217 5133,,3.7,hotel,,ahmedabad,gujarat,"Kalupur Railway Station Rd, near Ashirwad Market"
Hotel DREAMLANDD,"chandkhed 3rd floor a, BRTS stop 382424, nr. Shiv Shakti Nagar, Durga Krupa Society, Nigam Nagar, Chandkheda, Ahmedabad, Gujarat 382424",oyorooms.com,097279 85415,,4.5,hotel,,ahmedabad,gujarat,"chandkhed 3rd floor a, BRTS stop 382424"
Hotel Good Night,"opposite Sidi Saiyad Jali, Bhadra Rd, near Electricity House, Gheekanta, Lal Darwaja, Ahmedabad, Gujarat 380001",hotelgoodnight.co.in,,,4.1,hotel,,ahmedabad,gujarat,"opposite Sidi Saiyad Jali, Bhadra Rd"
BloomSuites | Ahmedabad,"34, Surdhara Rd, opp. Kolkata Kulture, Nilmani Society, Thaltej, Ahmedabad, Gujarat 380054",staybloom.com,079 4702 0222,,4.4,hotel,,ahmedabad,gujarat,"34, Surdhara Rd"
HOTEL PALAV PALACE,"oppo Bharat petrol pump, Bhagyoday Shopping Center, n.h, Naroda, bethak, Ahmedabad, Gujarat 382330",,097256 62227,,4.3,hotel,,ahmedabad,gujarat,"oppo Bharat petrol pump, Bhagyoday Shopping Center"
Hotel Metropole,"2HGJ+JQ3, Relief Rd, Old City, Gheekanta, Bhadra, Ahmedabad, Gujarat 380001",,,,3.5,hotel,,ahmedabad,gujarat,"2HGJ+JQ3, Relief Rd"
"Lemon Tree Hotel, Ahmedabad","434/1, Mithakali Six, Cross Rd, Navrangpura, Ahmedabad, Gujarat 380006",lemontreehotels.com,,,3.9,hotel,,ahmedabad,gujarat,"434/1, Mithakali Six"
Hotel Mivaante,"Shalin Square, Hathijan Circle, Sardar Patel Ring Rd, opposite Viva Farm, Vinzol, Ahmedabad, Gujarat 382445",hotelmivaante.com,099251 11618,,4.5,hotel,,ahmedabad,gujarat,"Shalin Square, Hathijan Circle"
Sunshine Dormitory,"1752, 1756, Relief Rd, Old City, Panchkuwa, Zaveriwad, Kalupur, Ahmedabad, Gujarat 380001",,079 2535 4600,,4.0,hotel,,ahmedabad,gujarat,"1752, 1756"
HOTEL 440 A SERENE STAY,"HOTEL 440, opp. V S HOSPITAL, Madalpur Gam, Ellisbridge, Ahmedabad, Gujarat 380006",440hotel.in,090815 88440,,4.2,hotel,,ahmedabad,gujarat,"HOTEL 440, opp. V S HOSPITAL"
Hotel Flair Inn,"Abhinav Arcade, Ashram Rd, near Kothawala Flats, Pritam Nagar, Paldi, Ahmedabad, Gujarat 380007",hotelflairinn.com,094294 84029,,4.1,hotel,,ahmedabad,gujarat,"Abhinav Arcade, Ashram Rd"
Hotel New Kunj Villa,"4th Floor, Shukan Mall, Nr.Visat Petrol Pump, Chandkheda, Ahmedabad, Gujarat 382424",hotelnewkunjvilla.com,070437 20712,,4.4,hotel,,ahmedabad,gujarat,"4th Floor, Shukan Mall"
"ITC Narmada, a Luxury Collection Hotel, Ahmedabad","Survey # 104 A, Judges Bunglow Rd, I I M, Vastrapur, Ahmedabad, Gujarat 380015",marriott.com,079 6966 4000,,4.7,hotel,,ahmedabad,gujarat,"Survey # 104 A, Judges Bunglow Rd"
Hotel Star,"GROUND FLOOR, KOTHARI HOSPITAL, GROUND Floor, Geeta complex, Vasna road, Anjali char rasta Near Smt. Sushilaben Kothari Charitable Hospital, Ahmedabad, Gujarat 380007",hotelstarahm.in,,,5.0,hotel,,ahmedabad,gujarat,"GROUND FLOOR, KOTHARI HOSPITAL"
Flagship Hotel Crystal,"1st Floor, Jivabhai Chamber, Ashram Rd, opposite BATA Showroom, Shreyas Colony, Navrangpura, Ahmedabad, Gujarat 380009",oyorooms.com,0124 620 1613,,3.0,hotel,,ahmedabad,gujarat,"1st Floor, Jivabhai Chamber"
HOTEL SAFARI INN,"2nd Floor, Dhaval Complex, behind Ganesh Plaza, Mithakhali, Navrangpura, Ahmedabad, Gujarat 380009",booking.com,091044 79571,,3.6,hotel,,ahmedabad,gujarat,"2nd Floor, Dhaval Complex"
The Ummed Ahmedabad,"The Ummed, Airport Cir, Sardarnagar, Hansol, Ahmedabad, Gujarat 382475",ummedhotels.com,079 6666 1234,,4.2,hotel,,ahmedabad,gujarat,"The Ummed, Airport Cir"
Everest Hotel,"Astodia Studio, Kalupur, Kalupur, beside Astodia Gate, Ahmedabad, Gujarat 380001",,079 2214 5005,,3.8,hotel,,ahmedabad,gujarat,"Astodia Studio, Kalupur"
