name,address,website,phone_number,reviews_count,reviews_average,category,subcategory,city,state,area
Coffee Clan,"Shivang Complex, Shop N0, 4 5 6, Urmi Rd, Opp Gail Office, Punit Nagar, Society, Vadodara, Gujarat 390007",,074054 12238,,4.4,cafe,,vadadora,gujarat,"Shivang Complex, Shop N0"
The Cave Cafe,"2nd floor, Midway Height, opp. SSG Hospital, near Kala Ghoda Circle, Dak Bunglaw, Sayajiganj, Vadodara, Gujarat 390020",instagram.com,088665 57838,,4.9,cafe,,vadadora,gujarat,"2nd floor, Midway Height"
The Tulip Touch Café,"The Tulip Touch Cafe, opposite Galleria Mall, Prafull Society, Tarangan Society, Akota, Vadodara, Gujarat 390007",,091061 83731,,4.5,cafe,,vadadora,gujarat,"The Tulip Touch Cafe, opposite Galleria Mall"
TIMES CAFE SAYAJIGUNJ,"FF1, Alankar Tower, Police Station, opp. Sayajigunj, Near Sayajigunj Police Station, Sarod, Sayajiganj, Vadodara, Gujarat 390007",,096626 89707,,4.2,cafe,,vadadora,gujarat,"FF1, Alankar Tower"
Cafe Bistro,"White Potato Restaurant, Shankheshwar Parshwanath Marg Ground floor, Opposit D-mart, Besides, Akota, Vadodara, Gujarat 390007",facebook.com,099043 19904,,4.2,cafe,,vadadora,gujarat,"White Potato Restaurant, Shankheshwar Parshwanath Marg Ground floor"
Friends Factory Cafe - Private Candle Light Dinner,"Priya Talkies Road, 424, OneWest, Asopalav W 4th Floor Besides Adventuraa, Sevasi - Canal Rd, Gotri, Vadodara, Gujarat 391101",friendsfactorycafe.com,074878 88730,,4.8,cafe,,vadadora,gujarat,"Priya Talkies Road, 424"
Charmant-The Heritage Café,"Contractor's Bungalow, Faramji Rd, opp. Railway Booking Office, Alkapuri, Vadodara, Gujarat 390007",,097730 50954,,4.3,cafe,,vadadora,gujarat,"Contractor's Bungalow, Faramji Rd"
Times Cafe,"Petrol Pump, 1st Floor Times Square Building, next to Fategunj, Fatehgunj, Vadodara, Gujarat 390002",timescafe.in,096626 89707,,4.1,cafe,,vadadora,gujarat,"Petrol Pump, 1st Floor Times Square Building"
Canara Coffee House,"852W+2MV, beside Premanand Hall, Dandia Bazar, Jambubet, Vadodara, Gujarat 390001",,083205 10892,,4.0,cafe,,vadadora,gujarat,"852W+2MV, beside Premanand Hall"
Caffein Cafe,"Gokul Society, 6, Vasna - Bhayli Main Rd, Vasna jakat Naka, Ravi Park Society, Saiyed Vasna, Vadodara, Gujarat 390012",caffein.co.in,074053 69369,,4.2,cafe,,vadadora,gujarat,"Gokul Society, 6"
Koa Café,"304-307, 3rd Floor, Boardway Signature, Nr. Adventuraa Fun Park, 30mtr, Canal Ring Road, TP-1, Sevasi, Vadodara, Gujarat 391101",koacafe.in,076000 06311,,4.2,cafe,,vadadora,gujarat,"304-307, 3rd Floor"
The Nirvaan Cafe & Lounge,"Sun Pharma Rd, Pramukh Swami nagar, Atladara, Vadodara, Gujarat 390012",,,,4.2,cafe,,vadadora,gujarat,"Sun Pharma Rd, Pramukh Swami nagar"
Cafe Brewito - Best cafe in vadodara | Best specialty coffee in town,"GF-1, Earth EON, Sama-Savli Rd, opp. Urmi School, Karelibagh, Vadodara, Gujarat 390024",cafebrewito.com,095869 68006,,4.1,cafe,,vadadora,gujarat,"GF-1, Earth EON"
The Signature Brew,"83 /A हाई विद्यालय, near बड़ोदा, Alkapuri, Vadodara, Gujarat 390007",,081412 87148,,4.1,cafe,,vadadora,gujarat,"83 /A हाई विद्यालय, near बड़ोदा"
Times Cafe HQ OP Road,"Sai Villa Complex, 103, Old Padra Rd, opp. Reliance Mall, Shripal Society, Madhav Nagar, Akota, Vadodara, Gujarat 390007",,096626 89707,,4.1,cafe,,vadadora,gujarat,"Sai Villa Complex, 103"
Cafe L'amour - Best Cafe In Vadodara For Birthday Celebration And Candle light Date,"FF- 46, Earth Eon Complex, Sama-Savli Rd, opp. Urmi School Over Bridge, New Sama, Vadodara, Gujarat 390024",instagram.com,088490 55749,,4.5,cafe,,vadadora,gujarat,"FF- 46, Earth Eon Complex"
"The Corner Cafe , Vadodara","The Corner Cafe 33-Phoenix Resicom ,Vaikunth Char Rasta, Waghodia Rd, Vadodara, Gujarat 390019",,073592 95384,,4.9,cafe,,vadadora,gujarat,"The Corner Cafe 33-Phoenix Resicom ,Vaikunth Char Rasta"
Times Cafe The Lounge,"The Corner Cafe 33-Phoenix Resicom ,Vaikunth Char Rasta, Waghodia Rd, Vadodara, Gujarat 390019",,073592 95384,,4.9,cafe,,vadadora,gujarat,"The Corner Cafe 33-Phoenix Resicom ,Vaikunth Char Rasta"
CENTRAL JAIL café,"Shop No. GF-10 Saffron Complex, Fatehgunj, Vadodara, Gujarat 390002",,,,4.0,cafe,,vadadora,gujarat,"Shop No. GF-10 Saffron Complex, Fatehgunj"
Woodbond Cafe,"Ankodiya Rd, New Alkapuri, Laxmipura, Panchvati, Vadodara, Ankodiya, Gujarat 390021",,098254 69563,,4.5,cafe,,vadadora,gujarat,"Ankodiya Rd, New Alkapuri"
Canara Coffee House,"852W+2MV, beside Premanand Hall, Dandia Bazar, Jambubet, Vadodara, Gujarat 390001",,083205 10892,,4.0,cafe,,vadadora,gujarat,"852W+2MV, beside Premanand Hall"
Times Cafe The Lounge,"852W+2MV, beside Premanand Hall, Dandia Bazar, Jambubet, Vadodara, Gujarat 390001",,083205 10892,,4.0,cafe,,vadadora,gujarat,"852W+2MV, beside Premanand Hall"
Charmant-The Heritage Café,"Contractor's Bungalow, Faramji Rd, opp. Railway Booking Office, Alkapuri, Vadodara, Gujarat 390007",,097730 50954,,4.3,cafe,,vadadora,gujarat,"Contractor's Bungalow, Faramji Rd"
TeaMax Cafe Vadodara,"Shop number 43,44, Phonix Resicom, Waghodia Rd, near vaikunth char rasta, Vadodara, Gujarat 390019",teamaxcafe.in,,,4.4,cafe,,vadadora,gujarat,"Shop number 43,44"
Pefeteria - Gujarat's 1st Pet Cafe,"Shop number 43,44, Phonix Resicom, Waghodia Rd, near vaikunth char rasta, Vadodara, Gujarat 390019",teamaxcafe.in,,,4.4,cafe,,vadadora,gujarat,"Shop number 43,44"
La Ville Cafe,"Abbas Tyabji Rd, near Methodist Church, Jayesh Colony, Fatehgunj, Vadodara, Gujarat 390002",,076000 31580,,4.6,cafe,,vadadora,gujarat,"Abbas Tyabji Rd, near Methodist Church"
Finca Restro-Cafe,"Abbas Tyabji Rd, near Methodist Church, Jayesh Colony, Fatehgunj, Vadodara, Gujarat 390002",,076000 31580,,4.6,cafe,,vadadora,gujarat,"Abbas Tyabji Rd, near Methodist Church"
Cafe Fitoor,"2,3, Landmark Complex, SB 1, below Thomas Cook, Vadodara, Gujarat 390007",,063521 32712,,4.5,cafe,,vadadora,gujarat,"2,3"
Cafe Motogaze,"Besides, Shakti Greens banquet and lawns, opposite The Emperor, near Bright Day School CBSE, Bhayli, Vadodara, Gujarat 390015",motogazevadodara.com,099786 87897,,4.5,cafe,,vadadora,gujarat,"Besides, Shakti Greens banquet and lawns"
Cafe Appetito - Alembic,"Shop No, Alembic Pharma Campus, 3, Alembic Rd, BIDC Gorwa Estate, Subhanpura, Vadodara, Gujarat 390003",,,,4.2,cafe,,vadadora,gujarat,"Shop No, Alembic Pharma Campus"
ROCKSOUL CAFE & BISTRO,"121, OneWest, Aasopalav W, Sevasi - Canal Rd, near Priya Talkies, Gotri, Vadodara, Gujarat 391101",,096620 01448,,4.4,cafe,,vadadora,gujarat,"121, OneWest"
THE DUGOUT CAFE,"13 & 14 BASEMENT, EMPEROR COMPLEX, Abbas Tyabji Rd, Jayesh Colony, Fatehgunj, Vadodara, Gujarat 390002",,079900 41728,,4.1,cafe,,vadadora,gujarat,"13 & 14 BASEMENT, EMPEROR COMPLEX"
The Delish Cafe || Best Cafe In Vadodara | Food Court In Vadodara | Cafeteria In Vadodara,"13 & 14 BASEMENT, EMPEROR COMPLEX, Abbas Tyabji Rd, Jayesh Colony, Fatehgunj, Vadodara, Gujarat 390002",,079900 41728,,4.1,cafe,,vadadora,gujarat,"13 & 14 BASEMENT, EMPEROR COMPLEX"
Lion's Cafe,"High Tension Rd, Subhanpura, Vadodara, Gujarat 390021",,088664 30549,,4.8,cafe,,vadadora,gujarat,"High Tension Rd, Subhanpura"
DARK BITE JUNGLE,"High Tension Rd, Subhanpura, Vadodara, Gujarat 390021",,088664 30549,,4.8,cafe,,vadadora,gujarat,"High Tension Rd, Subhanpura"
Karma Cafe,"Karma cafe, VIP Rd, near Jain derasar, Amit Nagar, Karelibagh, Vadodara, Gujarat 390018",,096013 56553,,4.5,cafe,,vadadora,gujarat,"Karma cafe, VIP Rd"
BOGO Unplugged (Cafe & Lounge),"Karma cafe, VIP Rd, near Jain derasar, Amit Nagar, Karelibagh, Vadodara, Gujarat 390018",,096013 56553,,4.5,cafe,,vadadora,gujarat,"Karma cafe, VIP Rd"
Times Cafe Gotri,"Lilleria 1038 Besides zydus House, Gotri Rd, Vadodara, Gujarat 390021",,096626 89707,,4.3,cafe,,vadadora,gujarat,"Lilleria 1038 Besides zydus House, Gotri Rd"
Darbargadh Cafeteria - Best Cafe in Vadodara,"Lilleria 1038 Besides zydus House, Gotri Rd, Vadodara, Gujarat 390021",,096626 89707,,4.3,cafe,,vadadora,gujarat,"Lilleria 1038 Besides zydus House, Gotri Rd"
Gazra Cafe,"inside Shri Maharani Chimnabai Stree Udyogalaya, opp. Sursagar Lake, Mandvi, Vadodara, Gujarat 390001",,082003 06871,,4.4,cafe,,vadadora,gujarat,"inside Shri Maharani Chimnabai Stree Udyogalaya, opp. Sursagar Lake"
Unplaned Cafe,"inside Shri Maharani Chimnabai Stree Udyogalaya, opp. Sursagar Lake, Mandvi, Vadodara, Gujarat 390001",,082003 06871,,4.4,cafe,,vadadora,gujarat,"inside Shri Maharani Chimnabai Stree Udyogalaya, opp. Sursagar Lake"
Meet me cafe,"S/12C, Indiabull megamall, Jetalpur Bridge, Road, Akota, Vadodara, Gujarat 390007",instagram.com,093287 04412,,4.2,cafe,,vadadora,gujarat,"S/12C, Indiabull megamall"
cafe hideaway,"S/12C, Indiabull megamall, Jetalpur Bridge, Road, Akota, Vadodara, Gujarat 390007",instagram.com,093287 04412,,4.2,cafe,,vadadora,gujarat,"S/12C, Indiabull megamall"
Lionize Restro Cafe,"703, Everest Onyx, above Fabindia, Race Course, Vadiwadi, Vadodara, Gujarat 390021",lionizerestrocafe.com,098981 77703,,4.6,cafe,,vadadora,gujarat,"703, Everest Onyx"
Times Cafe Racecourse,"703, Everest Onyx, above Fabindia, Race Course, Vadiwadi, Vadodara, Gujarat 390021",lionizerestrocafe.com,098981 77703,,4.6,cafe,,vadadora,gujarat,"703, Everest Onyx"
Offroad Cafe,"GF-23, Vihav Ensign, Nr. Bansal Mall, Gotri - Vasna Rd, Vadodara, Gujarat 390021",,095747 93197,,4.5,cafe,,vadadora,gujarat,"GF-23, Vihav Ensign"
Maggi House & Cafe. Candle Light Surprise Celebration,"GF-23, Vihav Ensign, Nr. Bansal Mall, Gotri - Vasna Rd, Vadodara, Gujarat 390021",,095747 93197,,4.5,cafe,,vadadora,gujarat,"GF-23, Vihav Ensign"
Modernist Coffee,"701, Sears tower, Gotri Rd, Vadodara, Gujarat 390021",,096012 59531,,4.2,cafe,,vadadora,gujarat,"701, Sears tower"
Cafe Chai Zaika - Fatehgunj,"701, Sears tower, Gotri Rd, Vadodara, Gujarat 390021",,096012 59531,,4.2,cafe,,vadadora,gujarat,"701, Sears tower"
NIGHT LIFE CAFE - FATEHGUNJ,"opp. Rosary High School, Pratapgunj, Vadodara, Gujarat 390002",,,,4.7,cafe,,vadadora,gujarat,"opp. Rosary High School, Pratapgunj"
Size Zero Cafe Bhayli,"opp. Rosary High School, Pratapgunj, Vadodara, Gujarat 390002",,,,4.7,cafe,,vadadora,gujarat,"opp. Rosary High School, Pratapgunj"
Cafe Amistoso | Vadodara,"Sixth floor, Cafe Amistoso, Vihav Trade Centre, 601, Bhayli, Vadodara, Gujarat 391410",amistoso.cafe,074360 72824,,4.7,cafe,,vadadora,gujarat,"Sixth floor, Cafe Amistoso"
Kaffa Coffee Roasters,"Sixth floor, Cafe Amistoso, Vihav Trade Centre, 601, Bhayli, Vadodara, Gujarat 391410",amistoso.cafe,074360 72824,,4.7,cafe,,vadadora,gujarat,"Sixth floor, Cafe Amistoso"
Sky Roof Restaurant & Cafe,"6th floor, Aarya's corner point, 601, opp. Voltamp transformer, near crossing, Makarpura, Maneja, Vadodara, Gujarat 390013",,081550 00501,,4.5,cafe,,vadadora,gujarat,"6th floor, Aarya's corner point"
"Cafe Chai Zaika, Sayajigunj","Aurobindo Ghosh Rd, Near Sayajigunj Police Station, Maharaja Sayajirao University, Sayajiganj, Vadodara, Gujarat 390007",,082009 95732,,4.5,cafe,,vadadora,gujarat,"Aurobindo Ghosh Rd, Near Sayajigunj Police Station"
lerro's cafe,"Aurobindo Ghosh Rd, Near Sayajigunj Police Station, Maharaja Sayajirao University, Sayajiganj, Vadodara, Gujarat 390007",,082009 95732,,4.5,cafe,,vadadora,gujarat,"Aurobindo Ghosh Rd, Near Sayajigunj Police Station"
coffea vadodara 3.0,"Below VEDA I Canal Road, Nizampura Rd, near Canal, TP 13, Chhani, Vadodara, Gujarat 390024",instagram.com,081600 79670,,4.5,cafe,,vadadora,gujarat,"Below VEDA I Canal Road, Nizampura Rd"
Tasu's Cafe,"Below VEDA I Canal Road, Nizampura Rd, near Canal, TP 13, Chhani, Vadodara, Gujarat 390024",instagram.com,081600 79670,,4.5,cafe,,vadadora,gujarat,"Below VEDA I Canal Road, Nizampura Rd"
"Soul Brew Coffee, Vasna Road","Shop No 6, Vasna Rd, Tagore Nagar, Diwalipura, Vadodara, Gujarat 390007",soulbrewcoffee.in,090990 56421,,4.2,cafe,,vadadora,gujarat,"Shop No 6, Vasna Rd"
Crush Coffee,"Shop No 6, Vasna Rd, Tagore Nagar, Diwalipura, Vadodara, Gujarat 390007",soulbrewcoffee.in,090990 56421,,4.2,cafe,,vadadora,gujarat,"Shop No 6, Vasna Rd"
Ramani's Cafe - Authentic South Indian Café in Vadodara,"Samanvay Status 2 complex, G65, Padra Road, Atladara, Vadodara, Gujarat 390012",,094449 89625,,4.7,cafe,,vadadora,gujarat,"Samanvay Status 2 complex, G65"
CACAO KOFFEE PROJECT,"Vasant Vihar Rd A, opposite Springs Exotica II, near Meridian Park, Saiyed Vasna, Vadodara, Gujarat 391410",,098798 15625,,4.2,cafe,,vadadora,gujarat,"Vasant Vihar Rd A, opposite Springs Exotica II"
Devi's Coffee Bar,"Vasant Vihar Rd A, opposite Springs Exotica II, near Meridian Park, Saiyed Vasna, Vadodara, Gujarat 391410",,098798 15625,,4.2,cafe,,vadadora,gujarat,"Vasant Vihar Rd A, opposite Springs Exotica II"
zippyfeed cafe vadodara,"Uma Char Rasta, Taxashia Society, Prabhat Nagar, Waghodia, Vadodara, Gujarat 390019",zippyfeed.com,,,4.3,cafe,,vadadora,gujarat,"Uma Char Rasta, Taxashia Society"
Tea Post - A Place to Talk,"E-10, Jetalpur Rd, Kashivishweshwar Township, Haripura, Vadodara, Gujarat 390007",teapost.in,099043 29991,,4.3,cafe,,vadadora,gujarat,"E-10, Jetalpur Rd"
"The Cake Cafe -Best cakes & Dessert shop vasna, gotri","E-10, Jetalpur Rd, Kashivishweshwar Township, Haripura, Vadodara, Gujarat 390007",teapost.in,099043 29991,,4.3,cafe,,vadadora,gujarat,"E-10, Jetalpur Rd"
Soul Brew Coffee,"Arundeep Complex, Paris Nagar, Diwalipura, Vadodara, Gujarat 390007",facebook.com,090990 55439,,4.1,cafe,,vadadora,gujarat,"Arundeep Complex, Paris Nagar"
The Secret Cafe,"Arundeep Complex, Paris Nagar, Diwalipura, Vadodara, Gujarat 390007",facebook.com,090990 55439,,4.1,cafe,,vadadora,gujarat,"Arundeep Complex, Paris Nagar"
cafe,"Gf 18,19,20, S square mall, opposite Vishwamohini apartment, near Ganga jamuna hospital, Ganga Jamana Society, Subhanpura, Vadodara, Gujarat 390023",cafecup90s.com,084870 06466,,4.9,cafe,,vadadora,gujarat,"Gf 18,19"
Trippers cafe,"Gf 18,19,20, S square mall, opposite Vishwamohini apartment, near Ganga jamuna hospital, Ganga Jamana Society, Subhanpura, Vadodara, Gujarat 390023",cafecup90s.com,084870 06466,,4.9,cafe,,vadadora,gujarat,"Gf 18,19"
Cafe Teastro,"near Sun City Circle, Amrapali Society, Manjalpur, Vadodara, Gujarat 390011",,095582 72366,,4.7,cafe,,vadadora,gujarat,"near Sun City Circle, Amrapali Society"
Dev's Cafe,"near Sun City Circle, Amrapali Society, Manjalpur, Vadodara, Gujarat 390011",,095582 72366,,4.7,cafe,,vadadora,gujarat,"near Sun City Circle, Amrapali Society"
Urban Brewery,"Regent Tower, Vadodara 2, Chakli Cir, behind DALSON, Racecourse, Vadodara, Gujarat 390007",,091730 76481,,4.3,cafe,,vadadora,gujarat,"Regent Tower, Vadodara 2"
"TeaMax Cafe Tarsali , Vadodara","Regent Tower, Vadodara 2, Chakli Cir, behind DALSON, Racecourse, Vadodara, Gujarat 390007",,091730 76481,,4.3,cafe,,vadadora,gujarat,"Regent Tower, Vadodara 2"
CAFE 15,"Hotel Raajpath, RC Dutt Rd, near railway station, Alkapuri, Vadodara, Gujarat",,,,4.0,cafe,,vadadora,gujarat,"Hotel Raajpath, RC Dutt Rd"
Snaki Cafe Gotri,"Hotel Raajpath, RC Dutt Rd, near railway station, Alkapuri, Vadodara, Gujarat",,,,4.0,cafe,,vadadora,gujarat,"Hotel Raajpath, RC Dutt Rd"
Candle Light Date N Dinner & Rooftop Restaurant Vadodara,"5th Floor, 504, Samanvay Westbreeze, Gotri - Laxmipura Rd, opp. Anand Hospital, Laxmipura, Gotri, Vadodara, Gujarat 390021",,070691 15511,,4.8,cafe,,vadadora,gujarat,"5th Floor, 504"
Cafe Brocode,"5th Floor, 504, Samanvay Westbreeze, Gotri - Laxmipura Rd, opp. Anand Hospital, Laxmipura, Gotri, Vadodara, Gujarat 390021",,070691 15511,,4.8,cafe,,vadadora,gujarat,"5th Floor, 504"
Brew 13,"A6 Rajpath Society, Old Padra Rd, Vadodara, Gujarat 390007",brew13.cafe,090992 19699,,4.2,cafe,,vadadora,gujarat,"A6 Rajpath Society, Old Padra Rd"
Red Rose Cafe,"75WG+P98, Aashapuri Society, Sheetal Nagar, Akota, Vadodara, Gujarat 390007",,076660 67025,,4.8,cafe,,vadadora,gujarat,"75WG+P98, Aashapuri Society"
S P Cafe,"Tower B, Dabhoi - Waghodia Ring Rd, Waghodia, Vadodara, Gujarat 390025",instagram.com,096246 76533,,5.0,cafe,,vadadora,gujarat,"Tower B, Dabhoi - Waghodia Ring Rd"
Bae & ME,"Tower B, Dabhoi - Waghodia Ring Rd, Waghodia, Vadodara, Gujarat 390025",instagram.com,096246 76533,,5.0,cafe,,vadadora,gujarat,"Tower B, Dabhoi - Waghodia Ring Rd"
The Moonlight Cafe,"The moon light cafe, Sadarbazar Main Road, opp. Santushti ice-cream, Fatehgunj, Vadodara, Gujarat 390002",,,,4.0,cafe,,vadadora,gujarat,"The moon light cafe, Sadarbazar Main Road"
Kitly Corner Cafe,"85GR+336, Fatehganj Main Rd, Our LAdy Of Pillar Hospital, Near Convent School, Jayesh Colony, Fatehgunj, Vadodara, Gujarat 390002",,084019 42820,,4.2,cafe,,vadadora,gujarat,"85GR+336, Fatehganj Main Rd"
The Gossip Cafe (Anna's Juice Bar and Cafe) - Best Cafe and Restaurants In Vadodara,"85GR+336, Fatehganj Main Rd, Our LAdy Of Pillar Hospital, Near Convent School, Jayesh Colony, Fatehgunj, Vadodara, Gujarat 390002",,084019 42820,,4.2,cafe,,vadadora,gujarat,"85GR+336, Fatehganj Main Rd"
Invisible the talk,"Shop no Gf-04, Lakshya Complex, Abbas Tyabji Rd, beside subaelite hotel, Jayesh Colony, Fatehgunj, Vadodara, Gujarat 390002",,076004 80652,,4.4,cafe,,vadadora,gujarat,"Shop no Gf-04, Lakshya Complex"
ZOI Bistro By Nukkad Pe,"Shop no Gf-04, Lakshya Complex, Abbas Tyabji Rd, beside subaelite hotel, Jayesh Colony, Fatehgunj, Vadodara, Gujarat 390002",,076004 80652,,4.4,cafe,,vadadora,gujarat,"Shop no Gf-04, Lakshya Complex"
Sky Boat Cafe,"Annapurna Complex, Shop no. 1 , 4th floor Open terrace, near Makarpura police station, Manjalpur, Vadodara, Gujarat 390011",,,,4.6,cafe,,vadadora,gujarat,"Annapurna Complex, Shop no. 1"
Café Appetito Sarabhai,"Annapurna Complex, Shop no. 1 , 4th floor Open terrace, near Makarpura police station, Manjalpur, Vadodara, Gujarat 390011",,,,4.6,cafe,,vadadora,gujarat,"Annapurna Complex, Shop no. 1"
Tea Catcher Café,"Harekrishna Apartments, 20, Arunachal Rd, opp. Lakulesh Stationary, Jay Shri Narayan Nagar, Subhanpura, Vadodara, Gujarat 390023",,097223 23303,,4.4,cafe,,vadadora,gujarat,"Harekrishna Apartments, 20"
Zoop cafe,"Harekrishna Apartments, 20, Arunachal Rd, opp. Lakulesh Stationary, Jay Shri Narayan Nagar, Subhanpura, Vadodara, Gujarat 390023",,097223 23303,,4.4,cafe,,vadadora,gujarat,"Harekrishna Apartments, 20"
CHAI PIZZA ZONE- Best cafe in vadodara,"VIP Rd, Amit Nagar, Balaji Nagar, Karelibagh, Vadodara, Gujarat 390022",,073835 29994,,4.3,cafe,,vadadora,gujarat,"VIP Rd, Amit Nagar"
The Brewery.,"VIP Rd, Amit Nagar, Balaji Nagar, Karelibagh, Vadodara, Gujarat 390022",,073835 29994,,4.3,cafe,,vadadora,gujarat,"VIP Rd, Amit Nagar"
Cafe Appetito Skydeck - Bhayli,"SWC HUB, 201-A, Vasna - Bhayli Main Rd, opp. Rajpath Complex, near Food Castle, Bhayli, Vadodara, Gujarat 391410",,099747 73600,,4.0,cafe,,vadadora,gujarat,"SWC HUB, 201-A"
For & Ever Cafe,"SWC HUB, 201-A, Vasna - Bhayli Main Rd, opp. Rajpath Complex, near Food Castle, Bhayli, Vadodara, Gujarat 391410",,099747 73600,,4.0,cafe,,vadadora,gujarat,"SWC HUB, 201-A"
NIGHT LIFE CAFE,"National Highway 48, Baliyadev Temple Chowkdi, beside Gokul Restaurant, Makarpura, Vadodara, Gujarat 390014",night-life-cafe.grexa.site,078018 78198,,4.3,cafe,,vadadora,gujarat,"National Highway 48, Baliyadev Temple Chowkdi"
Cafe For Friends,"National Highway 48, Baliyadev Temple Chowkdi, beside Gokul Restaurant, Makarpura, Vadodara, Gujarat 390014",night-life-cafe.grexa.site,078018 78198,,4.3,cafe,,vadadora,gujarat,"National Highway 48, Baliyadev Temple Chowkdi"
Dal housie cafe,"Main road, nr. BBR bikers, Jayesh Colony, Fatehgunj, Vadodara, Gujarat 390002",,,,4.0,cafe,,vadadora,gujarat,"Main road, nr. BBR bikers"
Cheers Cafeteria,"Bihari Apartment, A-1/4, BesidesR.C.Dutt Road, Vadiwadi, Vadodara, Gujarat 390007",,,,4.9,cafe,,vadadora,gujarat,"Bihari Apartment, A-1/4"
Dream bean cafe 2.0 alkapuri,"building, 101, gamestone, Jetalpur Rd, opp. kasiwishvanath temple, Vadodara",,,,4.9,cafe,,vadadora,gujarat,"building, 101"
The Goodies Cafeteria,"Gol Bungalow, next to Post Office, behind Kalyan Cafe, Sarod, Sayajiganj, Vadodara, Gujarat 390007",,091737 68257,,3.9,cafe,,vadadora,gujarat,"Gol Bungalow, next to Post Office"
